id,title,author,authors,isbn13,isbn10,price,publisher,pubyear,subjects,lexile,pages,dimensions
339,Montana Women Writers: A Geography of the Heart,Farcountry Press,"Farcountry Press, Sue Hart",9781560373797,1560373792,$18.95,Farcountry Press,2006,"Women Authors - Literature Anthologies, Regional American Anthologies, American Literature - Regional Literature - Literary Criticism, American Literature Anthologies",,395.0,5.92 (w) x 8.70 (h) x 1.18 (d)
326,American Negro Poetry,Arna Bontemps,"Arna Bontemps, Arna Bontemps",9780809015641,809015641,$17.47,"Farrar, Straus and Giroux",1995,"Poetry, American Literature Anthologies, Anthologies",,256.0,5.50 (w) x 8.50 (h) x 0.58 (d)
240,A Whole Other Ball Game: Women's Literature on Women's Sport,Joli Sandoz,Joli Sandoz,9780374525217,374525218,$20.91,"Farrar, Straus and Giroux",1997,"Women Authors - Literature Anthologies, Sports - General, Athletics - General & Miscellaneous, Sports & Adventure - Literary Anthologies, American Literature Anthologies",,288.0,5.50 (w) x 8.50 (h) x 0.75 (d)
12,Women Writing Africa: The Eastern Region,Amandina Lihamba,"Amandina Lihamba, Fulata L. Moyo, Mugaybuso M. Mulokozi",9781558615342,1558615342,$29.95,"Feminist Press at CUNY, The",2007,"Social Sciences, Women's Studies",,,
5,Women Writing Africa: West Africa and the Sahel,Esi Sutherland-Addy,"Esi Sutherland-Addy, Abena P. A. Busia, Aminata Diaw",9781558615007,1558615008,$29.95,"Feminist Press at CUNY, The",2005,"Literary Criticism - General & Miscellaneous, Oral Tradition & Storytelling, African Literature Anthologies",,560.0,6.00 (w) x 9.00 (h) x 1.30 (d)
20,Women Writing Africa: The Southern Region: Volume 1,Sheila Meintjes,"Sheila Meintjes, Dorothy Driver, Sheila Meintjes, Margie Orford, Chiedza Musengezi",9781558614062,1558614060,$1.99,"Feminist Press at CUNY, The",2002,"Places - Literary Anthologies, African Literature Anthologies, General & Miscellaneous African History, Women's History - Africa, Sub-Saharan",,560.0,6.30 (w) x 9.30 (h) x 1.50 (d)
366,Getting Home Alive,Aurora Levins Morales,"Aurora Levins Morales, Rosario Morales",9780932379191,932379192,$1.99,Firebrand Books,1986,"Puerto Ricans - General & Miscellaneous, Women Authors - Literature Anthologies, Puerto Ricans - Life in America, Peoples & Cultures - American Anthologies, Feminism & Feminist Theory, Literature Anthologies - General & Miscellaneous, Jewish Literature An",,213.0,5.50 (w) x 8.40 (h) x 0.60 (d)
487,Imagination And Spirit,J. Brent Bill,"J. Brent Bill, Shari Pickett Veach, C. Michael Curtis, J. Brent Bill",9780944350614,944350615,$18.43,Friends United Press,2006,"Society of Friends (Quakers), American Literature Anthologies",,292.0,5.50 (w) x 8.50 (h) x 0.66 (d)
299,No Walls of Stone: An Anthology of Literature by Deaf and Hard of Hearing Writers,Jill Jepson,Jill Jepson,9781563680199,156368019X,$33.50,Gallaudet University Press,2002,American Literature Anthologies,,232.0,6.00 (w) x 9.00 (h) x 0.90 (d)
321,Deaf Way II Anthology: A Literary Collection of Deaf and Hard of Hearing Writers,Tonya M. Stremlau,Tonya M. Stremlau,9781563681271,1563681277,$22.95,Gallaudet University Press,2002,"Peoples & Cultures - American Anthologies, American Literature Anthologies",,208.0,6.00 (w) x 9.00 (h) x 0.60 (d)
17,"Traditions in World Literature: Literature of Africa, Softcover Student Edition",McGraw-Hill,"McGraw-Hill, McGraw-Hill Staff",9780844212029,844212024,$7.55,Glencoe/McGraw-Hill,1999,Anthologies,,320.0,7.40 (w) x 9.10 (h) x 0.80 (d)
438,The Maine Reader: The Down East Experience from 1614 to the Present,Charles Shain,"Charles Shain, Samuella Shain",9781567920789,1567920780,$15.71,"Godine, David R. Publishers, Inc.",1997,"United States History - Northeastern & Middle Atlantic Region, American Literature Anthologies",,524.0,6.12 (w) x 9.44 (h) x 1.39 (d)
34,The Daily Show with Jon Stewart Presents Earth (the Book): A Visitor's Guide to the Human Race,Jon Stewart,Jon Stewart,9780446579223,044657922X,$1.99,Grand Central Publishing,2010,Humor,,244.0,8.40 (w) x 10.30 (h) x 0.90 (d)
496,Wines in the Wilderness: Plays by African American Women from the Harlem Renaissance to the Present,Elizabeth Brown-Guillory,"Elizabeth Brown-Guillory, Elizabeth Brown-Guillory",9780275935672,275935671,$27.95,"Greenwood Publishing Group, Incorporated",1990,"Drama Anthologies, American Drama, Peoples & Cultures - Drama, American Literature Anthologies",840L,272.0,8.90 (w) x 5.90 (h) x 0.80 (d)
244,"Women and Children of the Mills: An Annotated Guide to Nineteenth-Century American Textile Factory Literature, Vol. 28",Judith Ranta,Judith Ranta,9780313308604,313308608,$110.95,"Greenwood Publishing Group, Incorporated",1999,"U.S. Literature - Reference, Literary Reference - General & Miscellaneous, Businesswomen & Professional Women - Biography, United States Studies - General & Miscellaneous, Society & Culture in Literature, Labor Studies - General & Miscellaneous, American",,348.0,6.51 (w) x 9.61 (h) x 1.16 (d)
94,Nine Plays of the Modern Theater: Waiting for Godot; The Visit; Tango; The Caucasian Chalk Circle; The Balcony; Rhinoceros; American Buffalo; The Birthday Party; Rosencrantz and Guildenstern are Dead,Harold Clurman,Harold Clurman,9780802150325,802150322,$15.00,"Grove/Atlantic, Inc.",1994,"English, Scottish, & Welsh Drama, Drama Anthologies, American Drama, English & Irish Literature Anthologies, American Literature Anthologies",,912.0,6.10 (w) x 9.20 (h) x 1.70 (d)
331,100 Poems by 100 Poets,Harold Pinter,"Harold Pinter, Anthony Astbury, Geoffrey Godbert",9780802132796,802132790,$13.50,"Grove/Atlantic, Inc.",1994,"Poetry, American Literature Anthologies, Anthologies, English, Irish, & Scottish Poetry",,176.0,5.52 (w) x 8.25 (h) x 0.47 (d)
420,Word Virus,William S. Burroughs,"William S. Burroughs, James Grauerholz, Ira Silverberg, Ira Silverberg, James Grauerholz",9780802136947,080213694X,$10.08,"Grove/Atlantic, Inc.",2000,"Fiction, American Literature Anthologies, US & Canadian Literary Biography",,576.0,6.07 (w) x 9.07 (h) x 1.60 (d)
36,The Daily Show with Jon Stewart Presents Earth (the Book): A Visitor's Guide to the Human Race,Jon Stewart,Jon Stewart,9781607886150,1607886154,$24.98,Hachette Audio,2010,Literary Collections,,,
483,Every Shut Eye Ain't Asleep; An Anthology of Poetry by African Americans since 1945,Michael S. Harper,"Michael S. Harper, Anthony Walton",9780316347105,316347108,$18.40,Hachette Book Group,1994,"Poetry Anthologies, American Poetry, American Literature Anthologies",,344.0,5.50 (w) x 8.50 (h) x 0.77 (d)
377,Black Silk: A Collection of African-American Erotica,Retha Powers,Retha Powers,9780446676915,446676918,$23.21,Hachette Book Group,2002,"Short Story Anthologies, African Americans - Fiction & Literature, Peoples & Cultures - American Anthologies, Erotica",,356.0,5.00 (w) x 8.00 (h) x 0.79 (d)
406,Best American Magazine Writing 2004,American Society Of Magazine Editors,"American Society Of Magazine Editors, Susan Orlean",9780060749538,60749539,$1.99,HarperCollins Publishers,2004,"Other Media, Journalism, American Literature Anthologies",,560.0,5.31 (w) x 8.00 (h) x 0.89 (d)
105,Modern American Memoirs,Annie Dillard,"Annie Dillard, Cort Conley",9780060927639,60927631,$11.99,HarperCollins Publishers,1996,"Historical Biography - United States - General & Miscellaneous, U.S. Authors - 20th Century - Literary Biography, American Literature Anthologies",,464.0,5.31 (w) x 8.00 (h) x 1.04 (d)
308,Motherland: Writings by Irish American Women about Mothers and Daughters,Caledonia Kearns,"Caledonia Kearns, Caledonia Kearns",9780688175863,688175864,$13.95,HarperCollins Publishers,2000,"Family - Assorted Topics, American Literature Anthologies, General & Miscellaneous Literature Anthologies",,276.0,5.00 (w) x 8.00 (h) x 0.62 (d)
186,Queer 13: Lesbian and Gay Writers Recall Seventh Grade,Clifford Chase,Clifford Chase,9780688171612,688171613,$15.95,HarperCollins Publishers,1999,"Biographies &amp; Autobiographies, General",,,
103,Mental Floss: Scatterbrained,Editors Of Mental Floss,"Editors Of Mental Floss, Gre, Ransom Riggs, Will Hickman, John Green",9780060882501,60882506,$10.72,HarperCollins Publishers,2006,"Humor, American Literature Anthologies, General Reference",,256.0,7.18 (w) x 10.90 (h) x 0.68 (d)
379,"Damage Control: Women on the Therapists, Beauticians, and Trainers Who Navigate Their Bodies",Emma Forrest,Emma Forrest,9780061175350,61175358,$8.99,HarperCollins Publishers,2007,"Women Authors - Literature Anthologies, Essays and Individual Humorists, American Literature Anthologies",,304.0,5.31 (w) x 8.00 (h) x 0.68 (d)
66,Best Poems of the English Language: From Chaucer Through Robert Frost,Harold Bloom,Harold Bloom,9780060540425,60540427,$15.79,HarperCollins Publishers,2007,"Poetry, American Literature Anthologies, Anthologies, English, Irish, & Scottish Poetry",,1008.0,6.10 (w) x 9.20 (h) x 1.80 (d)
67,Humor Me: An Anthology of Funny Contemporary Writing (Plus Some Great Old Stuff Too),Ian Frazier,Ian Frazier,9780061728945,61728942,$25.99,HarperCollins Publishers,2010,"Humor, General",,,
480,More Mirth of a Nation: The Best Contemporary Humor,Michael J. Rosen,"Michael J. Rosen, Michael J. Rosen",9780060953225,60953225,$15.95,HarperCollins Publishers,2002,"Fiction, Humorous",,,
272,I Thought My Father Was God: And Other True Tales from NPR's National Story Project,Paul Auster,"Paul Auster, Paul Auster",9780060874117,60874112,$34.95,HarperCollins Publishers,2005,Literary Collections,,,
175,Rag and Bone Shop of the Heart: A Poetry Anthology,Robert Bly,"Robert Bly, James Hillman, Michael Meade",9780060924201,60924209,$13.82,HarperCollins Publishers,1993,"Poetry Anthologies, American Poetry, American Literature Anthologies",,560.0,5.31 (w) x 8.00 (h) x 1.26 (d)
129,"I Am Not My Breast Cancer: Women Talk Openly about Love and Sex, Hair Loss and Weight Gain, Mothers and Daughters, and Being a Woman with Breast Cancer",Ruth Peltason,"Ruth Peltason, Peter I. Pressman",9780061174070,61174076,$15.95,HarperCollins Publishers,2008,"Health &amp; Fitness, Women's Health",,,
287,The Best of the West: An Anthology of Classic Writing from the American West,Tony Hillerman,Tony Hillerman,9780060923525,60923520,$18.28,HarperCollins Publishers,1992,"Fiction, United States History - Western, Plains & Rocky Mountain Region, Americas - General & Miscellaneous History, American Literature Anthologies, United States History - General & Miscellaneous, Civilization - History, Fiction Subjects",,544.0,5.31 (w) x 8.00 (h) x 1.22 (d)
45,Couldn't Keep It to Myself: Testimonies from Our Imprisoned Sisters,Wally Lamb,"Wally Lamb, Diane Bartholomew, Nancy Birkla, Robin Cullen, Brenda Medina",9780060595371,006059537X,$10.59,HarperCollins Publishers,2004,"American Literature Anthologies, Penology & Correctional Studies, True Crime",,368.0,6.00 (w) x 9.00 (h) x 0.92 (d)
64,I'll Fly Away: Further Testimonies from the Women of York Prison,Wally Lamb,"Wally Lamb, I'll Fly Away Contributors",9780061626395,61626392,$10.99,HarperCollins Publishers,2008,"Penology & Correctional Studies - General & Miscellaneous, Prisons & Prison Life, American Literature Anthologies",,288.0,5.30 (w) x 7.90 (h) x 0.80 (d)
466,Writing New England: An Anthology from the Puritans to the Present,Andrew Delbanco,Andrew Delbanco,9780674006034,674006038,$1.99,Harvard University Press,2001,Regional American Anthologies,,512.0,6.42 (w) x 9.46 (h) x 1.49 (d)
408,Ethnic Modernism,Werner Sollors,Werner Sollors,9780674030916,674030915,$19.97,Harvard University Press,2008,"Modernism - Literary Movements, Literary Criticism - General & Miscellaneous, 20th Century American Literature - General & Miscellaneous - Literary Criticism, Society & Culture in Literature, Literary Criticism - U.S. Fiction & Prose Literature - General",,336.0,6.10 (w) x 9.20 (h) x 0.90 (d)
201,American Protest Literature,Zoe Trodd,"Zoe Trodd, Howard Zinn, John Stauffer",9780674027633,674027639,$16.45,Harvard University Press,2008,"Political Protest & Dissent, Political Activism & Social Action, Radical Thought, American Literature Anthologies",,576.0,5.90 (w) x 9.10 (h) x 1.20 (d)
30,Running Towards Us: New Writing from South Africa,Isabel Balseiro,"Isabel Balseiro, Isabel Balseiro",9780325002118,325002118,$33.63,Heinemann,2000,African Literature Anthologies,,216.0,5.90 (w) x 9.10 (h) x 0.50 (d)
22,Less Than One and Double: A Feminist Reading of African Women's Writing,Kenneth W. Harrow,Kenneth W. Harrow,9780325070254,325070253,$116.43,Heinemann,2001,"Literary Criticism - General & Miscellaneous, General & Miscellaneous African Literature - Literary Criticism, Women Authors - General & Miscellaneous - Literary Criticism, African Literature Anthologies",,384.0,
1,Opening Spaces: An Anthology of Contemporary African Women's Writing,Yvonne Vera,"Yvonne Vera, Yvonne Vera",9780435910105,435910108,$14.52,Heinemann,1999,"General & Miscellaneous Literature Anthologies, Anthologies",,186.0,5.07 (w) x 7.78 (h) x 0.42 (d)
431,Inlandia,Gayle Wattawa,"Gayle Wattawa, Susan Straight",9781597140379,1597140376,$18.34,Heyday Books,2006,"Regional American Anthologies, American Literature Anthologies",,448.0,6.10 (w) x 8.98 (h) x 1.15 (d)
341,Califauna: A Literary Field Guide,Terry Beers,"Terry Beers, Emily Elrod",9781597140492,159714049X,$21.29,Heyday Books,2007,"Animals - General, Nature, American Literature Anthologies, General & Miscellaneous Literature Anthologies, Plants & Fungi",,464.0,6.18 (w) x 9.00 (h) x 0.76 (d)
298,Essential Saroyan,William Saroyan,"William Saroyan, William E. Justice",9781597140010,1597140015,$11.57,Heyday Books,2005,Regional American Anthologies,,192.0,5.60 (w) x 8.58 (h) x 0.60 (d)
429,The Classic Hundred Poems: All-Time Favorites,William Harmon,"William Harmon, Various, Ensemble cast",9781598875782,1598875787,$29.95,HighBridge Company,2007,"Poetry, Anthologies (multiple authors)",,,
432,Literary Savannah,Patrick Allen,Patrick Allen,9781892514011,189251401X,$16.95,"Hill Street Press, LLC",2006,"Travel, Museums, Tours, Points of Interest",,,
485,Literary Nashville,Patrick Allen,"Patrick Allen, Madison Jones, Parke Godwin",9781892514110,1892514117,$16.95,"Hill Street Press, LLC",1999,"Literary Criticism, American",,,
401,The New England Transcendentalists: Life of the Mind and of the Spirit (Perspectives on History Series),Ellen Hansen,Ellen Hansen,9781932663174,1932663177,$7.95,"History Compass, LLC",2006,"Regional American Anthologies, 19th Century American Literature - Literary Criticism, American Literature Anthologies, 19th Century American Philosophy",,44.0,7.53 (w) x 4.67 (h) x 0.11 (d)
106,Best American Spiritual Writing 2007,Philip Zaleski,"Philip Zaleski, Harvey Cox",9780641974120,641974124,,Houghton Mifflin Company,2007,,,,
163,The Best American Essays 2008,Adam Gopnik,"Adam Gopnik, Robert Atwan",9780618983223,618983228,$11.92,Houghton Mifflin Harcourt,2008,"American Essays, American Literature Anthologies",,320.0,5.40 (w) x 8.10 (h) x 0.80 (d)
212,The Best American Short Stories 2001,Barbara Kingsolver,"Barbara Kingsolver, Katrina Kenison",9780395926888,395926882,$20.35,Houghton Mifflin Harcourt,2001,"American Fiction, Short Story Collections (Single Author), Short Story Anthologies, American Literature Anthologies",,402.0,5.50 (w) x 8.50 (h) x 0.89 (d)
35,The Best American Nonrequired Reading 2010,Dave Eggers,"Dave Eggers, David Sedaris",9780547241630,547241631,$11.17,Houghton Mifflin Harcourt,2010,"American Literature Anthologies, Fiction Subjects",,484.0,5.50 (w) x 8.20 (h) x 1.30 (d)
49,The Best American Nonrequired Reading 2009,Dave Eggers,"Dave Eggers, Marjane Satrapi",9780547241609,547241607,$14.39,Houghton Mifflin Harcourt,2009,"Short Story Anthologies, American Literature Anthologies",,432.0,5.40 (w) x 8.10 (h) x 1.20 (d)
214,The Best American Nonrequired Reading 2007,Dave Eggers,"Dave Eggers, Sufjan Stevens",9780618902811,618902813,$30.95,Houghton Mifflin Harcourt,2007,American Essays,,386.0,0.86 (w) x 5.50 (h) x 8.50 (d)
325,The Best American Nonrequired Reading 2008,Dave Eggers,"Dave Eggers, Judy Blume",9780618902835,061890283X,$13.48,Houghton Mifflin Harcourt,2008,"Short Story Anthologies, American Literature Anthologies",,400.0,5.40 (w) x 8.10 (h) x 1.10 (d)
374,Best American Nonrequired Reading 2005,Dave Eggers,"Dave Eggers, Beck",9780618570485,618570489,$30.95,Houghton Mifflin Harcourt,2005,"Short Story Anthologies, American Literature Anthologies",,370.0,5.50 (w) x 8.50 (h) x 0.82 (d)
448,The Book of American Negro Poetry,James Weldon Johnson,"James Weldon Johnson, James W. Johnson",9780156135399,156135396,$15.00,Houghton Mifflin Harcourt,1969,"Poetry, General",,,
51,The Best American Essays of the Century,Joyce Carol Oates,"Joyce Carol Oates, Robert Atwan",9780618155873,618155872,$14.84,Houghton Mifflin Harcourt,2001,"American Essays, American Literature Anthologies",,624.0,6.00 (w) x 9.00 (h) x 1.50 (d)
139,The Best American Short Stories 2004,Lorrie Moore,"Lorrie Moore, Katrina Kenison",9780618197354,618197354,$28.95,Houghton Mifflin Harcourt,2004,"American Fiction, Short Story Collections (Single Author), Short Story Anthologies, American Literature Anthologies",,498.0,1.11 (w) x 5.50 (h) x 8.50 (d)
90,The Latino Reader: An American Literary Tradition from 1542 to the Present,Margarite Fernandez Olmos,"Margarite Fernandez Olmos, Harold Augenbraum",9780395765289,395765285,$13.98,Houghton Mifflin Harcourt,1997,"Peoples & Cultures - American Anthologies, Hispanic & Latin American Literature Anthologies, Literature Anthologies - General & Miscellaneous",,528.0,5.50 (w) x 8.25 (h) x 0.50 (d)
41,The Best American Essays 2009,Mary Oliver,"Mary Oliver, Robert Atwan, Mary Oliver",9780618982721,618982728,$13.56,Houghton Mifflin Harcourt,2009,"American Essays, American Literature Anthologies",,224.0,5.40 (w) x 8.40 (h) x 0.60 (d)
97,The Best American Essays 2009,Mary Oliver,"Mary Oliver, Robert Atwan, Mary Oliver",9781616836863,1616836865,,Houghton Mifflin Harcourt,2009,,,,
154,The Best American Short Stories 2005,Michael Chabon,"Michael Chabon, Katrina Kenison",9780618427055,618427058,$17.98,Houghton Mifflin Harcourt,2005,"American Fiction, Short Story Collections (Single Author), Short Story Anthologies, American Literature Anthologies",,432.0,5.50 (w) x 8.25 (h) x 1.06 (d)
467,Crazy Woman Creek: Women Rewrite the American West,Nancy Curtis,"Nancy Curtis, Nancy Curtis, Gaydell Collier",9780618249336,618249338,$9.52,Houghton Mifflin Harcourt,2004,"American Literature Anthologies, Anthologies",,336.0,6.00 (w) x 9.00 (h) x 0.75 (d)
314,The Best American Short Stories 2002,Sue Miller,"Sue Miller, Katrina Kenison, Sue Miller, Katrina Kenison",9780618131730,618131736,$21.20,Houghton Mifflin Harcourt,2002,"American Fiction, Short Story Collections (Single Author), Short Story Anthologies, American Literature Anthologies",,402.0,5.50 (w) x 8.50 (h) x 0.89 (d)
153,Dream Me Home Safely: Writers on Growing Up in America,Susan Richards Shreve,"Susan Richards Shreve, Marian Wright Edelman President",9780618379026,618379029,$14.47,Houghton Mifflin Harcourt,2003,"U.S. Authors - 20th Century - Literary Biography, 20th Century American History - Social Aspects - General & Miscellaneous, Childhood Memoirs & Biography, Self-Improvement, American Literature Anthologies",,238.0,0.54 (w) x 5.50 (h) x 8.50 (d)
118,The Best American Short Stories 2003,Walter Mosley,"Walter Mosley, Katrina Kenison",9780618197330,618197338,$21.95,Houghton Mifflin Harcourt,2003,"American Fiction, Short Story Collections (Single Author), Short Story Anthologies, American Literature Anthologies",,386.0,0.86 (w) x 8.50 (h) x 5.50 (d)
147,The Best American Sports Writing 2008,William Nack,"William Nack, Glenn Stout",9780618751181,618751181,$13.58,Houghton Mifflin Harcourt,2008,"Sports Essays, American Literature Anthologies",,448.0,5.40 (w) x 8.10 (h) x 1.10 (d)
168,The Best American Sports Writing 2008,William Nack,"William Nack, Glenn Stout",9781615580194,1615580190,,Houghton Mifflin Harcourt,2008,,,,
231,"A Patriot'S Handbook: Songs, Poems, Stories, And Speeches Celebrating The Land We Love",Caroline Kennedy,Caroline Kennedy,9780786869183,786869186,$13.25,Hyperion,2003,"Poetry Anthologies, American Poetry, United States History - Reference, United States History - General & Miscellaneous, American Music - General & Miscellaneous, American Literature Anthologies, American Peoples & Cultures - Quotations, Speeches",,688.0,6.12 (w) x 9.25 (h) x 0.00 (d)
456,Sky Begins at Your Feet,Caryn Mirriam-Goldberg,Caryn Mirriam-Goldberg,9781888160437,1888160438,$15.69,Ice Cube Press,2009,"Cancer Patients - Biography, American Literature Anthologies",,242.0,6.10 (w) x 8.90 (h) x 0.80 (d)
423,"Iowa, the Definitive Collection: Classic and Contemporary Readings by Iowans, for Iowans",Zachary Michael Jack,Zachary Michael Jack,9781888160383,1888160381,$24.28,Ice Cube Press,2009,"United States History - Midwestern Region, American Literature Anthologies",,532.0,6.00 (w) x 9.00 (h) x 1.50 (d)
479,Decolonial Voices: Chicana and Chicano Cultural Studies in the 21st Century,Arturo J. Aldama,"Arturo J. Aldama, Naomi Qui?onez",9780253214928,253214920,$23.95,Indiana University Press,2002,"General & Miscellaneous American Art, Latin America & the Caribbean - Civilization, Latin Americans - General & Miscellaneous, United States - Civilization, Peoples & Cultures - American Anthologies, Regional Studies - Western U.S., Colonialism & Imperial",,432.0,6.10 (w) x 9.20 (h) x 0.90 (d)
9,Oral Epics from Africa,John William Johnson,"John William Johnson, Thomas A. Hale, Stephen  Belcher, Thomas A. Hale, Stephen Belcher",9780253211101,253211107,$24.95,Indiana University Press,2008,"Literary Criticism, African",,,
266,The Jazz Poetry Anthology,Sascha Feinstein,"Sascha Feinstein, Yusef Komunyakaa",9780253206374,253206375,$19.34,Indiana University Press,1991,"Poetry Anthologies, Poetry - General & Miscellaneous, American Poetry, American Literature Anthologies",,320.0,6.12 (w) x 9.23 (h) x 1.00 (d)
355,American Austen: The Forgotten Writing of Agnes Repplier,Agnes Repplier,"Agnes Repplier, John Lukacs",9781933859866,1933859865,$24.00,ISI Books,2009,American Literature Anthologies,,450.0,6.30 (w) x 9.30 (h) x 1.20 (d)
346,Slamma Lamma Ding Dong: An Anthology by Nebraska's Slam Poets,J. M. Huscher,"J. M. Huscher, Dan Leamen, Matt Mason, Dan Leamen, Matt Mason",9780595362974,595362974,$11.95,"iUniverse, Incorporated",2005,"Poetry Anthologies, Poetry - General & Miscellaneous, American Poetry, American Literature Anthologies",,126.0,6.14 (w) x 9.12 (h) x 0.35 (d)
148,The Lost Algonquin Round Table,Nat Benchley,"Nat Benchley, Kevin C. Fitzpatrick",9781440151514,1440151512,$18.95,"iUniverse, Incorporated",2009,"American & Canadian Literature, American Literature Anthologies, General & Miscellaneous Literature Anthologies, US & Canadian Literary Biography",,300.0,0.63 (w) x 5.50 (h) x 8.50 (d)
29,Glass Jars among Trees,Arja Salafranca,"Arja Salafranca, Alan Finlay",9781919931234,1919931236,$44.59,Jacana Media,2005,African Literature Anthologies,,188.0,7.75 (w) x 5.00 (h) x 0.47 (d)
19,Seventh Street Alchemy 2004: A Selection of Works from the Caine Prize for African Writing,Jacana Media,"Jacana Media, Monica Arac de Nyeko, Doreen Baingana, Parselelo Kantai",9781770091450,1770091459,$25.13,Jacana Media,2006,"Short Story Anthologies, African Fiction, African Literature Anthologies",,228.0,5.75 (w) x 8.25 (h) x 0.50 (d)
173,"To The Shore Once More, Volume II: A Journey Down The Jersey Shore; Prose, Poetry, And Works Of Art",Frank Finale,"Frank Finale, George C. Valente, Rich Youmans",9780963290625,963290622,$48.00,Jersey Shore Publications,2001,Literary Collections,,,
208,"To the Shore Once More: A Portrait Of The Jersey Shore; Prose, Poetry, and Works of Art",Frank Finale,"Frank Finale, Finale Fran",9780963290618,963290614,$44.00,Jersey Shore Publications,1999,"Literary Criticism, General",,,
434,Caroling Dusk,Countee Cullen,"Countee Cullen, Countee Cullen",9780806513492,806513497,$15.45,Kensington Publishing Corporation,1993,"Poetry, American Literature Anthologies, Anthologies",,264.0,6.00 (w) x 9.00 (h) x 0.60 (d)
391,Literature and Aging: An Anthology,Martin Kohn,"Martin Kohn, Delese Wear, Carol Donley",9780873384667,873384660,$29.00,Kent State University Press,1993,"Aging - General & Miscellaneous, Literature Anthologies - General & Miscellaneous, Gerontology, English & Irish Literature Anthologies, American Literature Anthologies",,456.0,6.25 (w) x 9.18 (h) x 1.13 (d)
75,Poems That Touch the Heart,A.L. Alexander,"A.L. Alexander, A. L. Alexander, A. L. Alexander",9780385044011,385044011,$14.99,Knopf Doubleday Publishing Group,1984,"Poetry Anthologies, American Poetry, American Literature Anthologies, Inspirational & Religious Poetry - General & Miscellaneous",,464.0,5.79 (w) x 8.54 (h) x 1.55 (d)
351,Tuscany in Mind,Alice Leccese Powers,"Alice Leccese Powers, Alice Leccese Powers",9781400076758,1400076757,$11.42,Knopf Doubleday Publishing Group,2005,"Northern Italy - Tuscany - Travel, Italy - Travel Essays & Descriptions, English & Irish Literature Anthologies, American Literature Anthologies",,400.0,5.10 (w) x 8.00 (h) x 1.00 (d)
283,Beat Poets,Carmela Ciuraru,"Carmela Ciuraru, Kevin Young",9780375413322,375413324,$10.63,Knopf Doubleday Publishing Group,2002,"Poetry Anthologies, American Poetry, American Literature Anthologies",,256.0,4.40 (w) x 6.53 (h) x 0.77 (d)
142,Bordering Fires: The Vintage Book of Contemporary Mexican and Chicano/a Literature,Cristina Garcia,Cristina Garcia,9781400077182,1400077184,$13.95,Knopf Doubleday Publishing Group,2006,"Peoples & Cultures - American Anthologies, Hispanic & Latin American Literature Anthologies",,304.0,5.25 (w) x 7.96 (h) x 0.66 (d)
