id,title,author,authors,isbn13,isbn10,price,publisher,pubyear,subjects,lexile,pages,dimensions
220,Three Centuries of American Poetry,Allen Mandelbaum,"Allen Mandelbaum, Robert D. Richardson",9780553375183,553375180,,Random House Publishing Group,1999,"Poetry, Anthologies (multiple authors)",,,
245,Rising Voices,Arlene Hirschfelder,"Arlene Hirschfelder, Beverly R. Singer",9780804111676,804111677,$6.99,Random House Publishing Group,1993,"American Literature Anthologies, General & Miscellaneous Native American Studies, Native North American People",,131.0,4.20 (w) x 6.86 (h) x 0.40 (d)
126,Fierce Pajamas: An Anthology of Humor Writing from the New Yorker,David Remnick,"David Remnick, Henry Finder",9780375761270,375761276,$16.24,Random House Publishing Group,2002,Humor,,528.0,6.14 (w) x 9.20 (h) x 1.12 (d)
74,The Voice That Is Great within Us: American Poetry of the Twentieth Century,Hayden Carruth,"Hayden Carruth, Susan Kagen Podell",9780553262636,553262637,$8.40,Random House Publishing Group,1983,"Poetry Anthologies, American Poetry, American Literature Anthologies",,768.0,4.15 (w) x 6.85 (h) x 1.25 (d)
188,Voices in Our Blood: America's Best on the Civil Rights Movement,Jon Meacham,Jon Meacham,9780375758812,037575881X,$14.98,Random House Publishing Group,2003,"Peoples & Cultures - American Anthologies, American Literature Anthologies",,576.0,6.16 (w) x 9.21 (h) x 1.27 (d)
137,The American Transcendentalists: Essential Writings,Lawrence Buell,Lawrence Buell,9780812975093,081297509X,$11.75,Random House Publishing Group,2006,American Literature Anthologies,,640.0,5.17 (w) x 7.99 (h) x 1.26 (d)
247,Literary Journalism: A New Collection of the Best American Nonfiction,Mark Kramer,"Mark Kramer, Norman Sims",9780345382221,345382226,$10.98,Random House Publishing Group,1995,"Journalism - Collections & History, American Essays, American Literature Anthologies, Journalism - General & Miscellaneous",,480.0,6.00 (w) x 9.00 (h) x 0.82 (d)
119,Spider Woman's Granddaughters: Traditional Tales and Contemporary Writing by Native American Women,Paula Gunn Allen,Paula Gunn Allen,9780449905081,044990508X,$10.31,Random House Publishing Group,1990,"American Literature Anthologies, Native American Folklore & Mythology, Anthologies, World Literature, Fiction Subjects, Native North American People",,288.0,5.06 (w) x 7.97 (h) x 0.56 (d)
195,Out of Her Mind: Women Writing on Madness,Rebecca Shannonhouse,Rebecca Shannonhouse,9780375755026,375755020,$14.22,Random House Publishing Group,2003,"American Literature Anthologies, Women's Biography, Psychological Disorders, Anthologies, Women's Biography, Fiction Subjects, Patient Narratives",,224.0,5.20 (w) x 8.00 (h) x 0.50 (d)
246,Brotherman: The Odyssey of Black Men in America--an Anthology,Robert Allen,"Robert Allen, Herb Boyd",9780345383174,345383176,$1.99,Random House Publishing Group,1996,"Peoples & Cultures - American Anthologies, African Americans - General & Miscellaneous, American Literature Anthologies",,960.0,5.48 (w) x 8.24 (h) x 1.56 (d)
182,Short Story Masterpieces,Robert Penn Warren,"Robert Penn Warren, Albert Erskine",9780440378648,440378648,$7.99,Random House Publishing Group,1954,"American Literature Anthologies, Anthologies, Fiction Subjects",,528.0,4.19 (w) x 6.90 (h) x 1.15 (d)
178,Boricuas: Influential Puerto Rican Writings--- An Anthology,Roberto Santiago,"Roberto Santiago, Roberto Santiago",9780345395023,345395026,$13.99,Random House Publishing Group,1995,"American Literature Anthologies, World Literature, Fiction Subjects",,400.0,5.50 (w) x 8.10 (h) x 0.80 (d)
263,New York Stories: The Best Writing from Four Decades of New York Magazine,Steve Fishman,"Steve Fishman, John Homans, Adam Moss, Tom Wolfe",9780812979923,812979923,$14.98,Random House Publishing Group,2008,"Places - Literary Anthologies, Regional American Anthologies",,624.0,6.20 (w) x 9.10 (h) x 1.40 (d)
206,"Women of the Beat Generation: The Writers, Artists and Muses at the Heart of a Revolution",Brenda Knight,"Brenda Knight, Ann Charters, Anne Waldman",9781573241380,1573241385,$16.63,Red Wheel/Weiser,1998,"American & Canadian Literature, American Literature Anthologies, Women's Biography, Anthologies, US & Canadian Literary Biography, Artists, Architects & Photographers - Biography, Literary Figures - Women's Biography, Women's Biography, General & Miscella",,366.0,6.90 (w) x 7.90 (h) x 1.20 (d)
499,For She Is the Tree of Life: Grandmothers Through the Eyes of Women Writers,Valerie Kack-Brice,Valerie Kack-Brice,9781573240376,1573240370,$14.95,Red Wheel/Weiser,1996,"Literary Criticism, General",,,
174,Winter Song: Christmas Readings,Madeleine L'Engle,"Madeleine L'Engle, Luci Shaw",9781573833325,1573833320,$1.99,Regent College Publishing,2004,"General & Miscellaneous Religion, American Literature Anthologies, General & Miscellaneous Literature Anthologies",,208.0,6.00 (w) x 9.00 (h) x 0.48 (d)
145,Bronx Accent: A Literary and Pictorial History of the Borough,Lloyd Ultan,"Lloyd Ultan, Barbara Unger",9780813538624,813538629,$24.95,Rivergate Books,2006,"United States History - Northeastern & Middle Atlantic Region, American Literature Anthologies, U.S. Travel - Major Cities, General & Miscellaneous Literature Anthologies, Travel - General & Miscellaneous, U.S. Travel - States, Photography - Travel, Trave",,330.0,7.00 (w) x 9.90 (h) x 0.90 (d)
211,Elements of Evolutionary Genetics,Brian Charlesworth,"Brian Charlesworth, Deborah Charlesworth",9780981519425,981519423,$73.92,Roberts & Company Publishers,2010,"Organic Chemistry, Regional American Anthologies, Microscopes & Microscopy - General & Miscellaneous, Folklore - General & Miscellaneous, Fiction - General & Miscellaneous, Genetics - Variations and Mutations, American Literature Anthologies, Cognitive Ps",,768.0,7.30 (w) x 10.20 (h) x 1.80 (d)
388,"Literatura Chicana, 1965-1995: An Anthology in Spanish, English, and Calo, Vol. 191",Garland,"Garland, David Foster, Manuel De Jesus Hernandez-Gutier",9780815320807,815320809,$84.75,Routledge,1997,American Literature Anthologies,,520.0,5.50 (w) x 8.50 (h) x 1.05 (d)
500,White Lines: Writers on Cocaine,Geno Zanetti,"Geno Zanetti, Stephen Hyde, Terry Southern, Richard Rudgley",9781560253785,1560253789,$15.98,Running Press Book Publishers,2002,"Substance Use & Abuse - Medical Aspects, Substance Use & Abuse, English & Irish Literature Anthologies, American Literature Anthologies, Drugs & Controlled Substances - Social Aspects",,352.0,5.80 (w) x 8.90 (h) x 1.00 (d)
209,Witnessing Lynching: American Writers Respond,Anne P. Rice,"Anne P. Rice, Michele Wallace",9780813533308,813533309,$22.77,Rutgers University Press,2003,"American Literature Anthologies, Criminology, Discrimination & Prejudice",,360.0,7.00 (w) x 9.90 (h) x 0.80 (d)
372,Daughters Of Decadence,Elaine Showalter,Elaine Showalter,9780813520186,813520185,$27.95,Rutgers University Press,1993,"American Literature Anthologies, Anthologies, Literary Movements",,352.0,5.00 (w) x 8.00 (h) x 0.78 (d)
199,Asian American Studies Now: A Critical Reader,Jean Yu-wen Shen Wu,"Jean Yu-wen Shen Wu, Thomas C. Chen",9780813545752,813545757,$35.40,Rutgers University Press,2010,"Asian American Studies - General & Miscellaneous, Peoples & Cultures - American Anthologies, United States History - Ethnic Histories",,672.0,7.00 (w) x 10.00 (h) x 1.80 (d)
370,Asian American Studies: A Reader,Jean Yu-wen Shen Wu,"Jean Yu-wen Shen Wu, Min Song",9780813527260,813527260,$26.95,Rutgers University Press,2000,"Asian American Studies - General & Miscellaneous, Peoples & Cultures - American Anthologies, United States History - Ethnic Histories",,600.0,6.99 (w) x 9.94 (h) x 1.35 (d)
347,Shadowed Dreams: Women's Poetry of the Harlem Renaissance,Maureen Honey,"Maureen Honey, Nellie Y. McKay",9780813538860,813538866,$21.99,Rutgers University Press,2006,Literary Collections,,374.0,6.00 (w) x 8.90 (h) x 1.00 (d)
358,Bold Words: A Century of Asian American Writing,Rajini Srikanth,"Rajini Srikanth, Esther Yae Iwanaga",9780813529660,813529662,$27.37,Rutgers University Press,2001,"American Literature Anthologies, United States Studies, Asians & Asian Americans - Biography, Ethnic & Minority Studies - United States, Asian American Studies",,480.0,7.00 (w) x 10.00 (h) x 0.94 (d)
258,The New Anthology of American Poetry: Volume II: Modernisms: 1900-1950,Steven Gould Axelrod,"Steven Gould Axelrod, Camille Roman, Camille Roman, Thomas Travisano, Camille Roman",9780813531649,813531640,$32.39,Rutgers University Press,2005,"Poetry, American Literature Anthologies, Anthologies",,856.0,5.90 (w) x 9.00 (h) x 1.60 (d)
384,"The New Anthology of American Poetry: Volume I: Traditions and Revolutions, Beginnings to 1900",Steven Gould Axelrod,"Steven Gould Axelrod, Camille Roman, Camille Roman, Thomas J. Travisano, Camille Roman",9780813531625,813531624,$36.05,Rutgers University Press,2003,"Poetry, American Literature Anthologies, Anthologies",,768.0,6.10 (w) x 9.20 (h) x 1.40 (d)
279,Double-Take: A Revisionist Harlem Renaissance Anthology,Venetria Patton,"Venetria Patton, Maureen Honey",9780813529301,813529301,$26.88,Rutgers University Press,2001,"Places - Literary Anthologies, Regional American Anthologies, Peoples & Cultures - American Anthologies, American Literature Anthologies, African American Art",,670.0,7.00 (w) x 10.00 (h) x 1.00 (d)
290,Best New Poets: 50 Poems from Emerging Writers,Kim Addonizio,"Kim Addonizio, Jeb Livingood",9780976629641,097662964X,$11.95,Samovar Press,2009,"Poetry, American Literature Anthologies, Anthologies",,158.0,7.00 (w) x 8.30 (h) x 0.60 (d)
472,"Off Off Broadway Festival Plays, 34th Series",Various,Various,9780573697555,573697558,$8.95,"Samuel French, Incorporated",2010,"Drama, American Literature Anthologies, General & Miscellaneous Drama, Anthologies",,116.0,5.00 (w) x 8.00 (h) x 0.24 (d)
396,Death Defying Acts,Woody Allen,"Woody Allen, Elaine May, David Mamet",9780573695391,573695393,$9.55,"Samuel French, Incorporated",1996,"Drama Anthologies, American Drama, Comedy - Drama, American Literature Anthologies",,132.0,5.00 (w) x 8.00 (h) x 0.28 (d)
442,All Things Censored [With CD],Mumia Abu-Jamal,"Mumia Abu-Jamal, Noelle Hanrahan, Alice Walker",9781583220221,1583220224,$23.96,Seven Stories Press,2003,"Prisoners & Accused Persons - Biography, Individual Trials & Litigation, Political Activists & Social Reformers - U.S. Political Biography, Administration of Criminal Justice, Political Activism & Social Action, Prisons & Prison Life, African Americans -",,304.0,6.67 (w) x 9.07 (h) x 1.07 (d)
282,The Beat Book: Writings from the Beat Generation,Anne Waldman,"Anne Waldman, Allen Ginsberg",9781590304556,1590304551,$15.32,"Shambhala Publications, Inc.",2007,American Literature Anthologies,,400.0,5.20 (w) x 8.36 (h) x 1.06 (d)
47,The Best American Poetry 2010,Amy Gerstler,"Amy Gerstler, David Lehman",9781439181454,1439181454,$13.87,Simon & Schuster Adult Publishing Group,2010,"Poetry Anthologies, American Poetry, American Literature Anthologies",,229.0,5.40 (w) x 8.30 (h) x 0.70 (d)
310,The Best American Poetry 2010,Amy Gerstler,"Amy Gerstler, David Lehman",9781439181478,1439181470,,Simon & Schuster Adult Publishing Group,2010,Poetry,,,
293,The Best American Poetry 2006,Billy Collins,"Billy Collins, David Lehman",9780743257596,743257596,$16.00,Simon & Schuster Adult Publishing Group,2006,"Poetry, American",,,
164,The Best American Poetry 2008,Charles Wright,"Charles Wright, David Lehman",9780743299756,743299752,$16.00,Simon & Schuster Adult Publishing Group,2008,"Poetry Anthologies, American Poetry, American Literature Anthologies",,224.0,8.34 (w) x 10.90 (h) x 0.58 (d)
286,The Best American Erotic Poems: From 1800 to the Present,David Lehman,David Lehman,9781416537465,1416537465,$14.59,Simon & Schuster Adult Publishing Group,2008,"Poetry, American Literature Anthologies, Anthologies, General & Miscellaneous Poetry",,336.0,5.50 (w) x 8.44 (h) x 0.90 (d)
295,Great American Prose Poems,David Lehman,David Lehman,9780743243506,743243501,$14.10,Simon & Schuster Adult Publishing Group,2003,"Poetry Anthologies, American Poetry, American Literature Anthologies",,352.0,5.50 (w) x 8.44 (h) x 1.00 (d)
39,The Best American Poetry 2009,David Wagoner,"David Wagoner, David Lehman",9781615521647,161552164X,,Simon & Schuster Adult Publishing Group,2009,,,,
99,The Best American Poetry 2009,David Wagoner,"David Wagoner, David Lehman",9780743299770,743299779,$16.00,Simon & Schuster Adult Publishing Group,2009,"Poetry Anthologies, American Poetry, American Literature Anthologies",,240.0,5.48 (w) x 8.28 (h) x 0.64 (d)
357,The Best American Poetry 2009,David Wagoner,"David Wagoner, David Lehman",9780743299763,743299760,$35.00,Simon & Schuster Adult Publishing Group,2009,"Poetry, Anthologies (multiple authors)",,,
292,The Best American Poetry 2007,Heather McHugh,"Heather McHugh, David Lehman",9780743299732,743299736,$1.99,Simon & Schuster Adult Publishing Group,2007,"Poetry, American Literature Anthologies, Anthologies",,192.0,5.60 (w) x 8.40 (h) x 0.50 (d)
428,Tenderheaded: A Comb-Bending Collection of Hair Stories,Juliette Harris,"Juliette Harris, Pamela Johnson, Ntozake Shange",9780671047566,671047566,$18.07,Simon & Schuster Adult Publishing Group,2002,"Beauty & Grooming, American Literature Anthologies, Anthologies",,320.0,6.46 (w) x 0.85 (h) x 9.22 (d)
185,In a Narrow Grave: Essays on Texas,Larry McMurtry,Larry McMurtry,9780684868691,684868695,$10.92,Simon & Schuster Adult Publishing Group,2001,"United States History - Southern Region, Essays, American Literature Anthologies, United States History - General & Miscellaneous, Civilization - History",,208.0,5.30 (w) x 8.00 (h) x 0.50 (d)
419,Latina,Lillian Castillo-speed,Lillian Castillo-speed,9780684802404,684802406,$17.97,Simon & Schuster Adult Publishing Group,1995,"Latinos - General, Women Authors - Literature Anthologies, Peoples & Cultures - American Anthologies, Hispanic & Latin American Literature Anthologies, American Literature Anthologies",,288.0,0.66 (w) x 5.50 (h) x 8.50 (d)
451,The Best American Poetry 2005,Paul Muldoon,"Paul Muldoon, David Lehman",9780743257589,743257588,$15.05,Simon & Schuster Adult Publishing Group,2005,"Poetry Anthologies, American Poetry, American Literature Anthologies",,224.0,5.50 (w) x 8.44 (h) x 0.60 (d)
135,"Black Theatre USA, V2: Plays by African Americans 1935-Today, Vol. 2",Ted Shine,"Ted Shine, Ted Shine, James Vernon Hatch, James V. Hatch, Ted Shine",9780684823072,684823071,$19.27,Simon & Schuster Adult Publishing Group,1996,"Peoples & Cultures - American Anthologies, Drama Anthologies, American Drama, Peoples & Cultures - Drama, American Literature Anthologies",,528.0,7.00 (w) x 9.90 (h) x 1.30 (d)
328,The Black Woman: An Anthology,Toni Cade Bambara,"Toni Cade Bambara, Eleanor W Traylor",9780743476973,743476972,$16.02,Simon & Schuster Adult Publishing Group,2005,"Peoples & Cultures - American Anthologies, African Americans - General & Miscellaneous",,352.0,5.31 (w) x 8.25 (h) x 1.00 (d)
360,The Best American Poetry 2003,Yusef Komunyakaa,"Yusef Komunyakaa, David Lehman",9780743203883,743203887,$15.05,Simon & Schuster Adult Publishing Group,2003,"Poetry Anthologies, American Poetry, American Literature Anthologies",,256.0,5.50 (w) x 8.44 (h) x 0.74 (d)
101,I Am the Darker Brother: An Anthology of Modern Poems by African Americans,Arnold Adoff,Arnold Adoff,9780689808692,689808690,$5.84,Simon & Schuster Children's Publishing,1997,"Poetry, American Literature Anthologies, Anthologies",,192.0,4.10 (w) x 6.80 (h) x 0.60 (d)
338,Voices in First Person: Reflections on Latino Identity,Lori Marie Carlson,"Lori Marie Carlson, Flavio Morais, Manuel Rivera-Ortiz",9781416906353,1416906355,$13.80,Simon & Schuster Children's Publishing,2008,American Literature Anthologies,,96.0,6.25 (w) x 8.38 (h) x 0.44 (d)
482,American Reader,Kathy-jo Wargin,"Kathy-jo Wargin, Kathryn Darnell, K. L. Darnell",9781585360956,1585360953,$11.65,Sleeping Bear Press,2006,"American Literature Anthologies, United States - People & Places",,96.0,5.60 (w) x 7.60 (h) x 0.50 (d)
386,Brother to Brother: New Writings by Black Gay Men,Essex Hemphill,"Essex Hemphill, Chuck Tarver, Jafari Allen, Joseph Beam",9780978625115,978625110,$12.55,Small Pr Distribution,2007,"Short Story Anthologies, African Americans - Fiction & Literature, Gay & Lesbian Fiction",,389.0,5.50 (w) x 8.50 (h) x 1.30 (d)
267,New Playwrights: The Best Plays of 2006,D. L. Lepidus,"D. L. Lepidus, Chungmi Kim",9781575255590,1575255596,$19.95,"Smith & Kraus, Inc.",2007,"Drama Anthologies, American Drama, American Literature Anthologies",,393.0,5.40 (w) x 8.40 (h) x 1.00 (d)
382,New Playwrights: The Best Plays of 2000,D. L. Lepidus,D. L. Lepidus,9781575252490,157525249X,$19.95,"Smith & Kraus, Inc.",2003,"Drama Anthologies, American Drama, American Literature Anthologies",,311.0,52.50 (w) x 82.50 (h) x 7.50 (d)
416,New Playwrights: The Best Plays of 2001,D. L. Lepidus,"D. L. Lepidus, Michael Kinghorn",9781575252971,157525297X,$1.99,"Smith & Kraus, Inc.",2003,"Drama Anthologies, American Drama, American Literature Anthologies",,352.0,
417,New Playwrights: The Best Plays of 2004,D. L. Lepidus,"D. L. Lepidus, Rosary O'Neill",9781575254241,1575254247,$19.95,"Smith & Kraus, Inc.",2005,"Drama, American Literature Anthologies, General & Miscellaneous Drama, Anthologies",,411.0,5.35 (w) x 8.50 (h) x 1.00 (d)
427,New Playwrights: The Best Plays of 2005,D. L. Lepidus,"D. L. Lepidus, Brian Mori",9781575254463,1575254468,$18.76,"Smith & Kraus, Inc.",2006,"Drama Anthologies, American Drama, American Literature Anthologies",,352.0,5.40 (w) x 8.40 (h) x 0.80 (d)
481,New Playwrights: The Best Plays of 2003,D. L. Lepidus,"D. L. Lepidus, Frances Hill",9781575253862,1575253860,$19.95,"Smith & Kraus, Inc.",2005,"Drama Anthologies, American Drama, American Literature Anthologies",,328.0,5.46 (w) x 8.54 (h) x 0.73 (d)
237,"The Women's Project and Productions: The Best One-Act Plays, 1975-1999",Julia Miles,Julia Miles,9781575252711,1575252716,$19.15,"Smith & Kraus, Inc.",2002,"Drama Anthologies, American Drama, American Literature Anthologies",,309.0,
215,The Best New Playwrights 2009,Lawrence Harbison,"Lawrence Harbison, Gina Gionfriddo",9781575257624,1575257629,$19.95,"Smith & Kraus, Inc.",2009,"Drama Anthologies, American Drama, American Literature Anthologies",,356.0,5.30 (w) x 8.40 (h) x 0.80 (d)
218,2007: The Best Ten-Minute Plays for Two Actors,Lawrence Harbison,"Lawrence Harbison, D. L. Lepidus",9781575255897,1575255898,$18.76,"Smith & Kraus, Inc.",2008,"Drama Anthologies, American Drama, American Literature Anthologies",,256.0,5.30 (w) x 8.40 (h) x 0.70 (d)
265,New Playwrights: The Best Plays of 2008,Lawrence Harbison,"Lawrence Harbison, John Cariani",9781575256184,1575256185,$19.95,"Smith & Kraus, Inc.",2009,"Drama Anthologies, American Drama, American Literature Anthologies",,384.0,5.40 (w) x 8.40 (h) x 0.80 (d)
285,New Playwrights: The Best Plays of 2007,Lawrence Harbison,"Lawrence Harbison, David Epstein",9781575255910,157525591X,$17.05,"Smith & Kraus, Inc.",2008,"Drama, American Literature Anthologies, General & Miscellaneous Drama, Anthologies",,416.0,5.30 (w) x 8.40 (h) x 0.90 (d)
354,"Twenty One-Acts from the Twenty Years at the Humana Festival, 1975-1995",Michele Volansky,"Michele Volansky, Michael Dixon",9781880399989,1880399989,$16.53,"Smith & Kraus, Inc.",1995,"Drama Anthologies, American Drama, American Literature Anthologies",,416.0,5.40 (w) x 8.49 (h) x 0.81 (d)
124,Don't Squat With Your Spurs On: A Cowboy's Guide to Life,Texas Bix Bender,Texas Bix Bender,9781423606994,142360699X,$7.99,"Smith, Gibbs Publisher",2009,"American Humor - Peoples & Cultures, American Literature Anthologies",,128.0,4.20 (w) x 6.70 (h) x 0.50 (d)
352,Don't Squat With Yer Spurs On!: A Cowboy's Guide to Life,Texas Bix Bender,Texas Bix Bender,9780879054700,879054700,$7.99,"Smith, Gibbs Publisher",2000,"Fiction, Humorous",,,
437,"Don't Squat With Yer Spurs On! II, Vol. 2",Texas Bix Bender,"Texas Bix Bender, L. Bark'karie",9780879058326,879058323,$1.99,"Smith, Gibbs Publisher",1997,"American Humor - Peoples & Cultures, American Literature Anthologies",,128.0,4.25 (w) x 6.75 (h) x 0.35 (d)
335,Bandana Republic: A Literary Anthology by Gang Members and Their Affliliates,Louis Reyes Rivera,"Louis Reyes Rivera, Bruce George",9781593761943,1593761945,$16.95,"Soft Skull Press, Inc.",2008,"Settings & Atmosphere - Fiction, American Literature Anthologies",,288.0,5.40 (w) x 8.40 (h) x 0.80 (d)
158,The Butterfly's Way: Voices from the Haitian Dyaspora in the United States,Edwidge Danticat,Edwidge Danticat,9781569472187,1569472181,$11.43,"Soho Press, Incorporated",2003,American Literature Anthologies,,280.0,5.51 (w) x 8.14 (h) x 0.71 (d)
498,First Thought Best Thought,Allen Ginsberg,"Allen Ginsberg, William S. Burroughs, Diane Di Prima",9781591791881,159179188X,$29.95,"Sounds True, Incorporated",2004,Literary Collections,,,
70,100 Best African American Poems with CD,Nikki Giovanni,Nikki Giovanni,9781402221118,1402221118,$18.39,"Sourcebooks, Incorporated",2010,"Poetry Anthologies, American Poetry, American Literature Anthologies",,256.0,8.40 (w) x 11.66 (h) x 0.94 (d)
123,Loving in the War Years: Lo que nunca paso por sus labios,Cherrie Moraga,Cherrie Moraga,9780896086265,896086267,$16.28,South End Press,2000,"Short Story Collections (Single Author), Hispanic Americans - Fiction & Literature, Peoples & Cultures - American Anthologies, Gay & Lesbian Fiction, Feminism & Feminist Theory, Literature Anthologies - General & Miscellaneous, Feminism & Literature",,264.0,5.30 (w) x 8.30 (h) x 0.50 (d)
150,Death Blossoms: Reflections from a Prisoner of Conscience,Mumia Abu-Jamal,"Mumia Abu-Jamal, Cornel West, Julia Wright",9780896086999,896086992,$12.00,South End Press,2003,"Biographies &amp; Autobiographies, General",,,
317,American Political Plays after 9/11,Allan Havis,"Allan Havis, Anne Nelson, Chay Yew, Naomi Iizuka, Kia Corthron",9780809329540,809329549,$14.94,Southern Illinois University Press,2010,"Drama Anthologies, American Drama, Political & Social Issues - Drama, American Literature Anthologies",,304.0,6.00 (w) x 9.00 (h) x 0.80 (d)
436,A River Through Illinois,Daniel V. Overturf,"Daniel V. Overturf, Gary Marx, Bill Kurtis",9780809327638,809327635,$37.42,Southern Illinois University Press,2008,"Nature, Marine Terrain, American Literature Anthologies, Travel - General & Miscellaneous, Aquatic Life & Sciences, U.S. Travel - States, Photography - Travel, Travel Photography, Natural Terrain",,256.0,12.00 (w) x 9.00 (h) x 1.30 (d)
397,American Studies Anthology,Richard P. Horwitz,Richard P. Horwitz,9780842028295,842028293,$44.65,Sr Books,2001,"United States History - Social Aspects, United States Studies - General & Miscellaneous, United States History - General & Miscellaneous, National Characteristics - North America, American Literature Anthologies",,416.0,0.93 (w) x 6.00 (h) x 9.00 (d)
234,Immigrant Women,Maxine Schwartz Seller,Maxine Schwartz Seller,9780791419045,791419045,$31.95,State University of New York Press,1994,Literary Collections,,,
359,Another Way to Dance: Contemporqary Asian Poetry from Canada and the United States,Cyril Dabydeen,Cyril Dabydeen,9780920661598,920661599,$19.95,T S A R Publications,1996,"Poetry, American Literature Anthologies, Anthologies",,272.0,5.77 (w) x 8.76 (h) x 0.64 (d)
454,This Bridge We Call Home: Radical Visions for Transformation,Gloria E. Anzaldua,"Gloria E. Anzaldua, AnaLouise Keating, Analouise Keating, Analouise Keating",9780415936828,415936829,$44.84,"Taylor & Francis, Inc.",2002,"American Literature Anthologies, Women's Biography, Anthologies, General & Miscellaneous Literary Criticism, Gay & Lesbian Studies, Women's Biography, Gay & Lesbian Biographies",,624.0,6.00 (w) x 8.80 (h) x 1.40 (d)
239,"Pamphlets of Protest: An Anthology of Early African American Protest Literature, 1790-1860",Richard G. Newman,"Richard G. Newman, Phillip Lapsansky, Patrick Rael",9780415924443,415924448,$39.95,"Taylor & Francis, Inc.",2000,"African Americans - General & Miscellaneous, United States History - African American History, United States History - 19th Century - Civil War, African American History, Social Sciences - General & Miscellaneous, Political Activism & Participation, Ameri",,320.0,7.00 (w) x 10.00 (h) x 0.70 (d)
413,A Beginner's Guide to Critical Reading: An Anthology of Literary Texts,Richard Jacobs,Richard Jacobs,9780415234689,415234689,$35.95,"Taylor & Francis, Inc.",2001,"Literary Criticism, General",,,
459,Literary Austin,Don Graham,Don Graham,9780875653426,875653421,,Texas Christian University Press,2007,History,,,
435,Literary Fort Worth,Judy Alter,"Judy Alter, James Ward Lee",9780875652535,875652530,$14.44,Texas Christian University Press,2002,Regional American Anthologies,,442.0,6.96 (w) x 9.98 (h) x 1.24 (d)
383,Xerophilia: Ecocritical Explorations in Southwestern Literature,Tom Lynch,"Tom Lynch, Scott Slovic",9780896726383,089672638X,$33.60,Texas Tech University Press,2008,"Literary Criticism - General & Miscellaneous, Techniques & Strategies in Environmental Conservation & Protection, American Literature - Regional Literature - Literary Criticism, Natural Literature & History, Environmental Conservation & Protection - Gener",,264.0,6.20 (w) x 8.30 (h) x 1.10 (d)
21,Of Suffocated Hearts and Tortured Souls: Seeking Subjecthood through Madness in Francophone Women's,ValZrie Orlando,"ValZrie Orlando, Valzrie Orlando, Valrie Orlando",9780739105627,739105620,$82.00,The Rowman & Littlefield Publishing Group Inc,2002,"Caribbean Fiction & Prose Literature - Literary Criticism, African Literature Anthologies, Psychology & Literature",,218.0,0.63 (w) x 6.00 (h) x 9.00 (d)
392,Salaam. Peace: An Anthology of Middle Eastern-American Drama,Holly Hill,Holly Hill,9781559363327,1559363320,$19.95,Theatre Communications Group,2010,"Drama Anthologies, American Drama, American Literature Anthologies",,400.0,6.00 (w) x 8.90 (h) x 1.20 (d)
